{
  "action_space": "joint_position_target",
  "command": "set_joint_targets",
  "contract_version": "ros2-obs-action/v1",
  "created_timestamp_ns": 1201000000,
  "model_id": "MOCK-policy-do-not-report-accuracy",
  "model_revision": "mock-0",
  "observation_id": "obs-0002",
  "sequence_id": 2,
  "simulated": true,
  "source_id": "MOCK-policy-01",
  "task_id": "task-synthetic-reach",
  "ttl_ms": 100,
  "units": [
    "rad",
    "rad",
    "rad",
    "rad",
    "rad",
    "m"
  ],
  "values": [
    0.161729,
    0.493594,
    0.497349,
    0.294317,
    0.023315,
    0.027631
  ]
}
